{
  "agfFormatVersion": 1,
  "id": "QA-2026-05-21-001",
  "title": "Doctor 'Procedural mesh registry' line silently lost when bootstrap aliases the registry to a local var",
  "filedAt": "2026-05-21T11:05:13.567Z",
  "foundInPr": 118,
  "foundInSprint": "S102",
  "severity": "minor",
  "type": "bug",
  "summary": "engine/tools/doctor/project-doctor.ts:964 â€” `summarizeProceduralMeshes` discovers registered keys via the regex `/proceduralMeshRegistry\\(\\)\\.register\\(\\s*[\"']([^\"']+)[\"']/g`. This locks the scan to the literal call form `runtime.renderer.proceduralMeshRegistry().register(\"...\", ...)`. S101's procbomber-bench bootstrap used exactly that form and the AGF-PROCMESH-DOCTOR-LINE acceptance â€” 'Procedural mesh registry: 1 declared key(s) [procbomber], 1 scene entity reference(s)' â€” was correct at S101 merge. S102 PROCBOMBER-MESH-TREE-V0 refactored the bootstrap to alias the registry once + register 6 part keys, the common readable pattern: `const procRegistry = runtime.renderer.proceduralMeshRegistry(); procRegistry.register(\"procbomber-torso\", ...); ...` (5 more lines). The aliased form is correct runtime code but the regex never sees `proceduralMeshRegistry()` immediately adjacent to `.register(...)`, so `declaredKeys` collapses to `[]` and `formatProceduralMeshes` suppresses the whole section. Net effect: the doctor's procedural-mesh observability is silently gone the moment a project registers more than one key (the natural moment a developer aliases the helper). Scene-side static count (`sceneUsageCount`) is also 0 for procbomber-bench because the 19-entity bomber tree is spawned at runtime via `bomber-tree-spawner.ts`, not declared in `scenes/start.scene.json` â€” that's by design, but it means the section relies entirely on `declaredKeys` and the regex must be permissive enough to catch the aliased pattern. Not a regression in the runtime registry (proc meshes render fine â€” confirmed via `runtime.renderer.proceduralMeshRegistry()` returning the live keys when introspected from `window.__agf`), only in the doctor's static scan.",
  "repro": [
    "From a fresh origin/main checkout (HEAD 4cde337 or later), run `npm run engine:doctor -- examples/procbomber-bench`.",
    "Scroll the output looking for a 'Procedural mesh registry:' line. There is none.",
    "Confirm the bootstrap genuinely registers 6 keys: `grep -n 'register(\"procbomber' examples/procbomber-bench/bootstrap.ts` â€” 6 hits (torso/head/upperArm/forearm/upperLeg/lowerLeg).",
    "Confirm the static scan is the failure point: `node -e \"const fs=require('node:fs'); const body=fs.readFileSync('examples/procbomber-bench/bootstrap.ts','utf8'); const re=/proceduralMeshRegistry\\(\\)\\.register\\(\\s*[\\\"']([^\\\"']+)[\\\"']/g; let m,keys=[]; while((m=re.exec(body))) keys.push(m[1]); console.log('Regex caught:', keys);\"` â€” prints `Regex caught: []`.",
    "Confirm runtime is fine â€” boot `?project=procbomber-bench` in the browser, then `window.__agf.runtime.renderer.proceduralMeshRegistry().keys()` lists all 6 keys (registry is populated at runtime, only the offline scan is blind)."
  ],
  "expected": "When a project registers procedural mesh keys â€” whether via the inline `proceduralMeshRegistry().register(...)` form OR via the natural alias `const procRegistry = ...proceduralMeshRegistry(); procRegistry.register(...)` form â€” engine doctor reports `Procedural mesh registry: 6 declared key(s) [procbomber-torso, procbomber-head, procbomber-upperArm, procbomber-forearm, procbomber-upperLeg, procbomber-lowerLeg], 0 scene entity reference(s)` (or whatever counts apply). The per-key sub-list still appears for any keys that scenes reference but the project never registers (the existing âš  flag).",
  "actual": "Doctor output skips the 'Procedural mesh registry:' section entirely. The format function's suppression gate (`if (report.declaredKeys.length === 0 && report.sceneUsageCount === 0)`) fires because the static-scan regex doesn't catch the aliased `procRegistry.register(...)` form. Devs (and the dogfood doctor section that was supposed to surface this) get no signal that a project has procedural meshes at all.",
  "logs": "engine/tools/doctor/project-doctor.ts:957-965\n  // S101 AGF-PROCMESH-DOCTOR-LINE: best-effort static scan.\n  // - declaredKeys: walk every .ts file under the project for the pattern\n  //   `proceduralMeshRegistry().register(\"<key>\"` (single OR double quotes).\n  // ...\n  const declaredSet = new Set<string>();\n  const registerRegex = /proceduralMeshRegistry\\(\\)\\.register\\(\\s*[\"']([^\"']+)[\"']/g;\n\nFix outlines (any of these would close the gap; pick one + add coverage):\n  - Two-pass scan: first sweep for `(?:const|let|var)\\s+(\\w+)\\s*=\\s*[^;]*\\bproceduralMeshRegistry\\(\\)` to learn the alias names, then sweep for `\\b(alias)\\.register\\(\\s*[\"']([^\"']+)[\"']` per alias. Catches the common pattern + survives renames within a file.\n  - Single-pass relaxed regex: `\\.register\\(\\s*[\"']([^\"']+)[\"']` anchored to files that contain the substring `proceduralMeshRegistry`. Cheap, risk of false positives if a file mentions the registry helper AND has unrelated `.register(...)` calls; OK for a best-effort doctor signal.\n  - AST parse via the TS compiler API. Cleanest but heavier; the rest of the doctor's static analysis is regex-based, so this would be the odd-one-out.\n\nLive evidence (post-S102 main):\n  $ npm run engine:doctor -- examples/procbomber-bench 2>&1 | grep -i 'procedural mesh'\n  (no output)\n\nReferenced acceptance lines:\n  S101 PROCBOMBER-BENCH-PROJECT: \"engine:doctor shows 'Procedural mesh registry: 1 declared key(s) [procbomber], 1 scene entity reference(s)'.\" â€” passed at S101 (inline form); broke at S102 refactor without anyone noticing.\n  S101 AGF-PROCMESH-DOCTOR-LINE: \"section is suppressed entirely otherwise\" â€” currently suppressed even when 6 keys ARE declared, because the scan never sees them.\n\nTest gap: tests/unit/doctor-procedural-meshes.test.ts (if it exists â€” needs a check) probably only exercises the inline form. Add a fixture that uses the alias pattern."
}
