{
  "agfFormatVersion": 1,
  "id": "QA-2026-05-27-001",
  "title": "Warp-hole UX — user still re-enters teleports with continuous movement after fix #184",
  "filedAt": "2026-05-27T15:43:29.665Z",
  "severity": "minor",
  "type": "ux",
  "summary": "User report after fix #184 (per-entity stamp): 'I don't like how teleports work — I appear from a random side and if I continue movement I get into a teleport again. I think teleport should not fire if you teleported into it but haven't gone outside.' The proposed behaviour is exactly what #184 implements at the SPECIFIC destination cell, but the user is still hitting re-warp during continuous motion. Two plausible gaps: (a) destination B is adjacent to ANOTHER warp pair's cell — user emerges at B holding ArrowRight, walks one cell off B (recentlyWarpedTo cleared), lands on a different warp, teleports again; (b) after stepping off destination, the user immediately steps back onto the SAME destination cell (recentlyWarpedTo was cleared the moment they left) — re-warps. The warpfield arena has 3 pairs / 6 cells and they can be close to each other; the user's continuous-input experience is plausibly correct. Fix #184's per-entity stamp is the right primitive but the granularity (clears on the first cell-change) is too short to feel calm in moment-to-moment play.",
  "repro": [
    "Open `?project=kaboom-crew`, switch to warpfield via `__agf.kaboom.loadMap('warpfield')`.",
    "Walk player.1 into any warp cell using continuous ArrowRight (or another direction) — don't tap, hold.",
    "After teleport, KEEP holding the direction key. Don't pause.",
    "Observed: bomber emerges at destination B, walks off B to a neighbour, and if the next cell along the same direction is another warp cell, teleports again. Visually 'bounces' through teleport events without the user releasing the key.",
    "Note: my Playwright tests for this case were unreliable because force-writing `GridPosition` doesn't trigger the grid-occupancy spatial index, and `kaboom.gotoCell` crashed with `Cannot set component \"AgentGoto\" on missing entity \"2\"` (a separate bug worth its own ticket). The repro above relies on live keyboard input."
  ],
  "expected": "Stronger UX rule: after teleporting, give the entity a brief grace window (~0.5 s, ≈ 2 grid steps at speed=4) during which NO warp on ANY cell fires for that entity. Alternative: 'pass-through' design — the warp cell delivers the entity to the cell ADJACENT to the destination in the direction they were walking, never standing on the destination warp itself. Many Bomberman-likes do this — the warp is a doorway, not a stopping point.",
  "actual": "Per-entity `recentlyWarpedTo` stamp clears the instant the entity's GridPosition stops matching the destination cell. With continuous input (key held) at speed=4 = 250 ms per cell, the entity is OFF the destination cell within one grid-mover tick — stamp cleared — eligible for re-warp the next step. If the user's path crosses any other warp cell (or comes back to the original destination), they teleport again.",
  "logs": "examples/kaboom-crew/src/systems/warp-hole-system.ts (post fix #184):\n  const recentlyWarpedTo = new Map<EntityId, { gx: number; gz: number }>();\n  ...\n  for (const [entityId, target] of recentlyWarpedTo) {\n    if (!world.hasEntity(entityId)) { recentlyWarpedTo.delete(entityId); continue; }\n    const pos = world.getComponent<GridPos>(entityId, GRID_POSITION);\n    if (pos === undefined || pos.gx !== target.gx || pos.gz !== target.gz) {\n      recentlyWarpedTo.delete(entityId);\n    }\n  }\n\nFix outlines:\n  1. **Time-based grace window**: stamp `(entityId → { destPos, expiresAt })` and skip ALL warp cells for the entity until expiresAt. ~0.5 s = 2 cells at speed=4. Lives in the system closure, no schema change.\n  2. **Pass-through design**: teleport delivers the entity to the cell ADJACENT to the destination in the direction they were walking (or to a deterministic non-warp non-blocked neighbour when direction is zero). The bomber is never STANDING on the destination — it's purely a portal. Eliminates the 'sticky destination' problem entirely. Slightly larger code change but more idiomatic.\n  3. **Entity-wide cooldown**: stamp `(entityId → expiresAt)` independent of cell. Until expiresAt, ALL warp cells skip this entity. Simplest possible patch on top of fix #184.\n\nVariant 2 matches the user's mental model best ('the warp is a door, I step through, not on it'). Variant 3 is the smallest diff if the dev wants to ship today.\n\nAdditional finding (worth its own ticket): `kaboom.gotoCell(2, 1)` throws `Cannot set component \"AgentGoto\" on missing entity \"2\"`. The agent-goto-system appears to use the cell COORDINATE as an entity id."
}
