{
  "agfFormatVersion": 1,
  "id": "QA-2026-06-03-001",
  "title": "Pool-reused bombs flash red at placement — pulse phase from Date.now() makes fresh bombs look ready-to-explode",
  "filedAt": "2026-06-03T06:37:19.346Z",
  "foundInPr": 252,
  "severity": "minor",
  "type": "bug",
  "summary": "User report: 'I noticed a bug — if you place a bomb (probably from a pool), if it's not the first, it's already red like ready to explode'. Reproduced live. Root cause: `examples/kaboom-crew/src/systems/bomb-fuse-system.ts:44-66` (`bombPulseColor`) pulses the bomb mesh between #2a2a2a (grey) and #ff5a2a (warm orange) on a triangle-wave whose phase is `(Date.now() / 1000) % period / period`. Period scales with fuse (calmer at fresh, faster as fuse drops) but the *amplitude* always reaches full orange. Fresh bombs that happen to be placed when the global pulse phase is near the orange peak appear immediately bright red, indistinguishable from a bomb about to detonate. The S196 PR body promised 'lerps to hot orange in final 0.6s' — the actual implementation pulses orange at ALL fuse values. Live evidence: probe-driven place-bomb, polled every 250ms; first poll showed `bomb.player.1.2 fuse=1.92 color=#eb562a` — orange-red at a fuse with 76% remaining. Not a pool reuse bug per se (bomb-placement-system.ts:139 explicitly resets `MeshRenderer.color` to `#1a1a1a` on each spawn) — bomb-fuse-system overrides on the very next frame using the global pulse phase. User's pool theory is correct in spirit: subsequent bombs DO inherit a 'wrong' state, just not literally from the pool — they inherit the global pulse phase that's been ticking the whole time.",
  "repro": [
    "Boot `?project=kaboom-crew`, start a round (Space).",
    "Set BomberStats `maxBombs:5` on player.1 via POST `/__agf/component/player.1/BomberStats`.",
    "Fire `/__agf/input/action {entityId:'player.1', action:'place-bomb'}`.",
    "Poll `/__agf/snapshot` every 250 ms for ~4 s; track the bomb entity's `MeshRenderer.color`.",
    "Observe: even at fuse=1.92 (76% remaining) the colour can already be `#eb562a` / `#ff5a2a` (the 'orange peak' of the pulse). Visually identical to a bomb at fuse=0.8.",
    "Cross-check: visually distinct from the S270 `critical-pulse` spark + the final-0.4s `#ff3030` flash (those still fire only at the end). Concern is purely the mesh tint."
  ],
  "expected": "Per the S196 PR body, the mesh tint should stay at the base colour (`#1a1a1a`) for the bulk of the fuse and only lerp to hot orange in the final ~0.6 s. Telegraph value is in the CONTRAST between fresh and about-to-blow bombs — a constant pulse defeats it. Two plausible fixes: (1) only run the pulse when `fuseRemaining < 1.0` (matching the wiggle's 2.0 threshold or a tighter one); (2) anchor the pulse phase to bomb placement time instead of `Date.now()` so a fresh bomb always starts at the grey end.",
  "actual": "`bombPulseColor` pulses the mesh between grey and orange on every frame regardless of fuse. The pulse period is `Math.max(0.08, fuseRemaining/8)` — at fuse=2.5 the cycle is 0.31 s; the triangle wave hits orange 50% of the time. A bomb placed at the wrong moment of the global pulse phase shows up bright orange immediately and stays oscillating into orange every 0.15 s. User reads this as 'pool-reused bomb is already red'.",
  "logs": "examples/kaboom-crew/src/systems/bomb-fuse-system.ts:44-66\n  export function bombPulseColor(fuseRemaining: number): string {\n    const t = Math.max(0, fuseRemaining);\n    const period = Math.max(0.08, t / 8);\n    const phase = (Date.now() / 1000) % period / period;\n    const tri = phase < 0.5 ? phase * 2 : (1 - phase) * 2;\n    const lerp = (a: number, b: number): number => Math.round(a + (b - a) * tri);\n    const r = lerp(0x2a, 0xff);\n    const g = lerp(0x2a, 0x5a);\n    const b = lerp(0x2a, 0x2a);\n    return `#${r.toString(16).padStart(2, \"0\")}${g.toString(16).padStart(2, \"0\")}${b.toString(16).padStart(2, \"0\")}`;\n  }\n\nLive trace (fresh place, then poll every 250 ms):\n  t=250ms : bomb.player.1.2 fuse=1.92 color=#eb562a   ← already orange-red\n  t=500ms : bomb.player.1.2 fuse=1.28 color=#eb562a\n  t=750ms : bomb.player.1.2 fuse=0.70 color=#eb562a\n  t=1000ms: bomb.player.1.2 fuse=0.17 color=#f9550c   ← critical zone (correct)\n\nFix outlines (any one closes the gap):\n  1. **Gate by fuse**: only override the bomb's mesh colour when `fuseRemaining < 1.0` (or 0.6 to match the PR body). Above the threshold leave the prefab's `#1a1a1a` intact. Cheapest change, matches user intent.\n  2. **Anchor pulse to bomb age**: pass `bomb.spawnedAt` (or compute from fuseRemaining) into `bombPulseColor` so the phase resets at zero on placement and always starts at the grey end of the lerp. Keeps the constant-pulse aesthetic if dev wants it, but the first ~half-period is always grey.\n  3. **Bias the triangle**: shift the lerp so `tri ∈ [0, 0.5]` maps to grey-only and only the final fuse band crosses into orange. Simplest two-line change but loses the 'pulse' shape.\n\nVariant 1 matches the S196 PR body literally — that's probably the intended behaviour. Add a quick unit test in `bomb-fuse-wiggle.test.ts` (or a new `bomb-fuse-color.test.ts`) asserting `bombPulseColor(2.5) === '#1a1a1a'` and `bombPulseColor(0.3)` is in the orange band."
}
